{
  "schema": "simplicity-amp-registry-v1",
  "protocol": "simplicity-amp/v0.1",
  "network": "liquid-testnet",
  "policyAsset": "144c654344aa716d6f3abcc1ca90e5641e4e2a7f633bc09fe3baf64585819a49",
  "regulatedAsset": "69e2005c0c9f19a1b56a6a056b38321010d7a0a8be2cca94dd0f521e4824f8f1",
  "verifierAsset": "b105aeb2a54bcc2b4135a52d7178998b2640fcbc5c05f80da7a1a61132d88ca3",
  "verifierAssetAmount": 1,
  "issuerPublicKey": "719d55d060fab86714c5841348a80134c0bb0b1feab7a561389549d210f87ee3",
  "deploymentSalt": "1be687cfacbdf77f5659b919d4fece6314a738036b6869ee9ebeb38dfac1addd",
  "genesisAnchor": "706d5fdcea70644f2235e008ad393dc89866337a4e20358bcc6b23c0a6af82c4:0",
  "asset": {
    "name": "RWA-TEST-1",
    "ticker": "RWT-1",
    "precision": 2
  },
  "issuedSupply": "100000",
  "supplyMode": "issuer-managed",
  "reissuanceToken": "f984e8c2b093cfb0100d52ae203e3fbfeb3cfbbf85ecbaa5d5908425681b8f0b",
  "reissuanceEntropy": "abb903ec235594556b64f4e741d4d7021bdad75f6b82f8e8f32c343c9b196ade",
  "userProgramHash": "ff6d98a0882b759a2527fe447435b552515705bdbc9ec23f601b706a1c6294e0",
  "governanceProgramHash": "494fba1f11c494f9c89294fcfcad54a6d8fee1e1d6052028c944353331a58581",
  "contractBundleHash": "fb5ad11d67c46fce7c9c0a20f4fca2fe550387e7b92b5527402b38e1ce85bb3f"
}
